{
  "locationId": "location-mapgenie-434380",
  "sourceLocationId": 434380,
  "categoryId": "category-12312-castle",
  "status": "high_confidence_inference",
  "confidence": 0.84,
  "summaryZhCN": "装备奖励 Tools Master Gear 已获两个独立来源一致支持；3,000经验值与2技能点仍为单一来源（整体保持高置信推断）",
  "rewards": [
    {
      "type": "experience",
      "nameOriginal": "XP",
      "nameZhCN": "经验值",
      "quantity": 3000,
      "quantityStatus": "exact",
      "rarity": null,
      "notesZhCN": "来源原文为 3,000 XP；当前仅由 MapGenie 支持。"
    },
    {
      "type": "skill_point",
      "nameOriginal": "Mastery Points",
      "nameZhCN": "技能点",
      "quantity": 2,
      "quantityStatus": "exact",
      "rarity": null,
      "notesZhCN": "来源原文为 2 Mastery Points；官方简中术语待游戏内复核，当前仅由 MapGenie 支持。"
    },
    {
      "type": "armor",
      "nameOriginal": "Tools Master Gear",
      "nameZhCN": "Tools Master Gear（传奇轻型护甲）",
      "quantity": null,
      "quantityStatus": "not_applicable",
      "rarity": "Legendary",
      "notesZhCN": "MapGenie 与 Game8 均指向 Katano Castle；保留来源英文专有名词。"
    }
  ],
  "sources": [
    {
      "sourceId": "mapgenie-location-434380",
      "sourceType": "community_database",
      "title": "MapGenie · Katano Castle",
      "publisherOrAuthor": "MapGenie",
      "locator": "https://mapgenie.io/assassins-creed-shadows/maps/japan?locationIds=434380",
      "capturedAt": null,
      "gameVersion": null,
      "supports": [
        "地点身份：Katano Castle",
        "奖励：3,000 XP",
        "奖励：2 Mastery Points",
        "奖励：Tools Master Gear - Legendary Light Armor",
        "reward:experience:XP",
        "reward:skill_point:Mastery Points",
        "reward:armor:Tools Master Gear"
      ],
      "limitationsZhCN": "社区数据库快照未记录游戏版本。"
    },
    {
      "sourceId": "game8-tools-master-gear-505568",
      "sourceType": "guide_article",
      "title": "Game8 · How to Get Tools Master Gear and Stats",
      "publisherOrAuthor": "Game8 Assassin's Creed Shadows Walkthrough Team",
      "locator": "https://game8.co/games/Assassins-Creed-Shadows/archives/505568",
      "capturedAt": "2026-07-20T21:40:00Z",
      "gameVersion": null,
      "supports": [
        "Tools Master Gear is Legendary Light Armor",
        "获取地点：Katano Castle 的 Legendary Chest",
        "reward:armor:Tools Master Gear"
      ],
      "limitationsZhCN": "仅支持装备奖励及获取地点，不支持3,000 XP或2 Mastery Points；页面未标注游戏版本。"
    }
  ],
  "conflicts": [
    {
      "type": "version_or_patch_mismatch",
      "status": "accepted_uncertainty",
      "detailZhCN": "两项来源均未记录对应游戏版本，且第二来源不覆盖经验值与技能点。",
      "resolutionZhCN": "整条记录继续保持高置信推断，等待当前版本游戏内复核。"
    },
    {
      "type": "translation_mismatch",
      "status": "accepted_uncertainty",
      "detailZhCN": "装备仅有英文名称，官方简中译名尚未确认。",
      "resolutionZhCN": "保留英文专有名词，不自行创造中文名称。"
    }
  ],
  "review": {
    "state": "machine_checked",
    "lastReviewedAt": "2026-07-20T21:40:00Z",
    "method": "reward-policy-v1 + per-reward-source-coverage",
    "reviewer": null,
    "changeReasonZhCN": "加入独立指南来源；装备奖励达到两来源一致，数值奖励仍为单一来源。"
  }
}
